doc_id,chunk_id,title,text,source,source_split,topic,question_id,original_hotpotqa_id,paragraph_index,is_gold_evidence,source_system,s2_corpus_role
hotpotqa_mini_0005_doc_06,hotpotqa_mini_0005_chunk_06,Carl B. Stokes United States Courthouse,"The Carl B. Stokes Federal Court House Building is a skyscraper located in downtown Cleveland, Ohio. It is also known as the Carl B. Stokes Federal Court House Tower, Federal Court House Tower, and the Stokes Tower. The 23-story building is 430 ft tall and is located at the corner of Huron Road and Superior Avenue. It is currently the fourth tallest United States courthouse in the country.",hotpotqa_huggingface_distractor,validation,geography,hotpotqa_mini_0005,5ab56e32554299637185c594,6,False,S1_hotpotqa_mini,shared_retrieval_corpus
hotpotqa_mini_0005_doc_07,hotpotqa_mini_0005_chunk_07,Real estate technology,"Real Estate Technology or Property Technology, often referred to as (""RE Tech"") or (""Proptech""), is an economic industry composed of companies which use technology to make real estate transactions more efficient. Real estate technology is a sub-category under financial technology as real estate is an asset class which represents a significant investment. Besides for own stay, there are investors who generate income and capital gains by investing in different categories of Real Estate properties over time - They are broadly residential, commercial and industrial. Historically used as a more tactical investment or for providing portfolio alpha, real estate has been used as part of a long-term core strategy due to increased market efficiency and increasing concerns about the future long-term variability of stock and bond returns. In fact, real estate is known for its ability to serve as a portfolio diversifier and inflation hedge.",hotpotqa_huggingface_distractor,validation,geography,hotpotqa_mini_0005,5ab56e32554299637185c594,7,False,S1_hotpotqa_mini,shared_retrieval_corpus
hotpotqa_mini_0005_doc_08,hotpotqa_mini_0005_chunk_08,Loan modification in the United States,"Loan modification is the systematic alteration of mortgage loan agreements that help those having problems making the payments by reducing interest rates, monthly payments or principal balances. Lending institutions could make one or more of these changes to relieve financial pressure on borrowers to prevent the condition of foreclosure. Loan modifications have been practiced in the United States since The 2008 Crash Of The Housing Market from Washington Mutual, Chase Home Finance, Chase, JP Morgan & Chase, other contributors like MER's. Crimes of Mortgage ad Real Estate Staff had long assisted nd finally the squeaky will could not continue as their deviant practices broke the state and crashed. Modification owners either ordered by The United States Department of Housing, The United States IRS or President Obamas letters from Note Holders came to those various departments asking for the Democratic process to help them keep their homes and protection them from explosion. Thus the birth of Modifications. It is yet to date for clarity how theses enforcements came into existence and except b whom, but t is certain that note holders form the Midwest reached out in the Democratic Process for assistance. FBI Mortgage Fraud Department came into existence. Modifications HMAP HARP were also birthed to help note holders get Justice through reduced mortgage by making terms legal. Modification of mortgage terms was introduced by IRS staff addressing the crisis called the HAMP TEAMS that went across the United States desiring the new products to assist homeowners that were victims of predatory lending practices, unethical staff, brokers, attorneys and lenders that contributed to the crash. Modification were a fix to the crash as litigation has ensued as the lenders reorganized and renamed the lending institutions and government agencies are to closely monitor them. Prior to modifications loan holders that experiences crisis would use Loan assumptions and Loan transfers to keep the note in the 1930s. During the Great Depression, loan transfers, loan assumption, and loan bail out programs took place at the state level in an effort to reduce levels of loan foreclosures while the Federal Bureau of Investigation, Federal Trade Commission, Comptroller, the United States Government and State Government responded to lending institution violations of law in these arenas by setting public court records that are legal precedence of such illegal actions. The legal precedents and reporting agencies were created to address the violations of laws to consumers while the Modifications were created to assist the consumers that are victims of predatory lending practices. During the so-called ""Great Recession"" of the early 21st century, loan modification became a matter of national policy, with various actions taken to alter mortgage loan terms to prevent further economic destabilization. Due to absorbent personal profits nothing has been done to educate Homeowners or Creditors that this money from equity, escrow is truly theirs the Loan Note Holder and it is their monetary rights as the real prize and reason for the Housing Crash was the profit n obtaining the mortgage holders Escrow. The Escrow and Equity that is accursed form the Note Holders payments various staff through the United States claimed as recorded and cashed by all staff in real-estate from local residential Tax Assessing Staff, Real Estate Staff, Ordinance Staff, Police Staff, Brokers, attorneys, lending institutional staff but typically Attorneys who are also typically the owners or Rental properties that are trained through Bankruptcies'. that collect the Escrow that is rightfully the Homeowners but because most Homeowners are unaware of what money is due them and how they can loose their escrow. Most Creditors are unaware that as the note holder that the Note Holder are due a annual or semi annual equity check and again bank or other lending and or legal intuitions staff claim this monies instead. This money Note Holders were unaware of is the prize of real estate and the cause of the Real Estate Crash of 2008 where Lending Institutions provided mortgages to people years prior they know they would eventually loose with Loan holders purchasing Balloon Mortgages lending product that is designed to make fast money off the note holder whom is always typically unaware of their escrow, equity and that are further victimized by conferences and books on HOW TO MAKE MONEY IN REAL STATE - when in fact the money is the Note Holder. The key of the crash was not the House, but the loan product used and the interest and money that was accrued form the note holders that staff too immorally. The immoral and illegal actions of predatory lending station and their staff began with the inception of balloon mortgages although illegal activity has always existed in the arena, yet the crash created ""Watch Dog"" like HAMP TEAM, IRS, COMPTROLLER< Federal Trade Commission Consumer Protection Bureau, FBI, CIA, Local Police Department, ICE ( The FBI online Computer crime division receives and investigates computer crimes that record keeping staff from title companies, lending institutional staff, legal staff and others created fraudulent documents to change payments and billing of note holders to obtain the money note holders are typically unaware of) and other watch dog agencies came into existence to examine if houses were purchased through a processed check at Government Debited office as many obtained free homes illegally. Many were incarcerated for such illegal actions. Modifications fixed the Notes to proper lower interest, escrow, tax fees that staff typically raised for no reason. Many people from various arenas involved in reals estate have been incarcerated for these actions as well as other illegal actions like charging for a modification. Additionally Modifications were also made to address the falsifications such as inappropriate mortgage charges, filing of fraudulently deeds, reporting of and at times filing of fraudulent mortgages that were already paid off that were fraudulently continued by lenders staff and attorneys or brokers or anyone in the Real Estate Chain through the issues of real estate terms to continue to violate United States Laws, contract law and legal precedence where collusion was often done again to defraud and steal from the Note Holder was such a common practice that was evidence as to why the Mortgage Crash in 2008 occurred for the purpose of wining the prize of stealing form Homeowners and those that foreclosed was actually often purposefully for these monies note holders were unaware of to be obtained which was why Balloon mortgages and loans were given to the staff in the Real Estate Market with the hoper and the expectation that the loan holders would default as it offered opportunity to commit illegal transactions of obtaining the homeowners funds. While such scams were addressed through modifications in 2008. The Market relied heavily on Consumers ignorance to prosper, ignorance of real estate terms, ignorance on what they were to be charged properly for unethical financial gain and while staff in real estates lending arenas mingled terms to deceive y deliberate confusion consumers out of cash and homes while the USA Government provided Justice through President Obamas Inception and IRS Inception of Modifications which addressed these unethical profits in Reals Estate. It was in 2009 that HARP, HAMP and Modifications were introduced to stop the victimization of Note Holders. Taking on the Banks that ran USA Government was a great and dangerous undertaking that made America Great Again as Justice for Consumers reigned. Legal action taken against institutions that have such business practices can be viewed in State Code of Law and Federal Law on precedent cases that are available to the public. Finally, It had been unlawful to be charged by an attorney to modify as well as fro banking staff to modify terms to increase a mortgage and or change lending product to a balloon in an concerted effort to make homeowner foreclose which is also illegal, computer fraud and not the governments intended purpose or definition of a modification.",hotpotqa_huggingface_distractor,validation,geography,hotpotqa_mini_0005,5ab56e32554299637185c594,8,False,S1_hotpotqa_mini,shared_retrieval_corpus
hotpotqa_mini_0005_doc_09,hotpotqa_mini_0005_chunk_09,South Phoenix,"South Phoenix is a region of Phoenix, Arizona, with the boundaries of the Gila River Indian Community to the south and west, 48th Street or Interstate-10 (Phoenix/Tempe and Phoenix/Chandler borders) to the east, and the Salt River to the north. This area includes Phoenix's following Urban Villages: South Mountain Village (aka South Mountain District) along with Laveen Village and Ahwatukee Village. The area is sometimes simply referred to as ""the Southside"" by its residents. Major arterial east-west streets include Broadway Road, Southern Avenue, Baseline Road, Dobbins Road, Elliott Road, Warner Road, Chandler Boulevard, and Pecos Road, most of which connect South Phoenix with the suburbs of Tempe and Chandler. Major arterial south-north streets include 24th Street, 16th Street, 7th Street, Central Avenue, 7th Avenue, and 19th Avenue connecting South Mountain Village to Central and North Phoenix; 27th Avenue, 35th Avenue, 43rd Avenue, 51st Avenue, 59th Avenue, 67th Avenue, and 75th Avenue connecting Laveen to west Phoenix; and 32nd Street, 40th Street, and 48th Street connecting South Mountain Village to east Phoenix and Tempe.",hotpotqa_huggingface_distractor,validation,geography,hotpotqa_mini_0005,5ab56e32554299637185c594,9,False,S1_hotpotqa_mini,shared_retrieval_corpus
hotpotqa_mini_0006_doc_00,hotpotqa_mini_0006_chunk_00,Fishing Lake,"Fishing Lake is a lake in the Canadian province of Saskatchewan. The lake is located between highway 5 and highway 16, 22 km north of the town of Foam Lake, Saskatchewan, and 24 km east of the town of Wadena, Saskatchewan. The lake does not have an effective outlet channel, and so is prone to flooding. Record floods in 2007 resulted in a plan by the Government of Saskatchewan to lower the level of the lake by digging a drainage channel. The Fishing Lake First Nation opposed this plan, and instead flood control berms were constructed.",hotpotqa_huggingface_distractor,validation,geography,hotpotqa_mini_0006,5a75e05c55429976ec32bc5f,0,False,S1_hotpotqa_mini,shared_retrieval_corpus
hotpotqa_mini_0006_doc_01,hotpotqa_mini_0006_chunk_01,Osage State Fishing Lake,"Osage State Fishing Lake is located in northern Osage County, Kansas. It is a mile east of US 75. Scranton, Kansas, is to the lake's northwest and Overbrook, Kansas, is to the northeast. Osage Lake is a freshwater man-made lake, constructed in 1955. It has a surface area of 140 acres, The parkland in which the lake is contained has 366 acreas of land, mostly tall grass prairie with numerous wooded areas. The lake is owned by the State of Kansas.",hotpotqa_huggingface_distractor,validation,geography,hotpotqa_mini_0006,5a75e05c55429976ec32bc5f,1,False,S1_hotpotqa_mini,shared_retrieval_corpus
hotpotqa_mini_0006_doc_02,hotpotqa_mini_0006_chunk_02,Brown State Fishing Lake,"Brown State Fishing Lake (sometimes also known as Brown State Fishing Lake And Wildlife Area) is a protected area in Brown County, Kansas in the United States. The lake is 62 acres (0.25 km²) in area and up to 13 feet (4 m) deep. The area was formerly known as Brown County State Park, and is 8 miles (13 km) east of Hiawatha, Kansas.",hotpotqa_huggingface_distractor,validation,geography,hotpotqa_mini_0006,5a75e05c55429976ec32bc5f,2,True,S1_hotpotqa_mini,shared_retrieval_corpus
hotpotqa_mini_0006_doc_03,hotpotqa_mini_0006_chunk_03,Neosho State Fishing Lake,"Neosho State Fishing Lake, also known as Lake McKinley is located in the state of Kansas. Located 5 mi north on highway 59 and 4 mi east on 40th Rd from the city of Parsons, Kansas, USA. Construction of this lake was completed in 1927. The lake covers 92 acre of water. There are 124 public use acres surrounding the lake. Fishing, camping, and picnicking are popular activities. The park has a shelter house, fishing piers, picnic tables, barbecue grills, vault toilets and water hydrant. Below Lake McKinley dam is a catch and release youth fishing pond for anglers age 15 and under when with an accompanying adult. The lake is operated by the Kansas Department of Wildlife and Parks.",hotpotqa_huggingface_distractor,validation,geography,hotpotqa_mini_0006,5a75e05c55429976ec32bc5f,3,False,S1_hotpotqa_mini,shared_retrieval_corpus
hotpotqa_mini_0006_doc_04,hotpotqa_mini_0006_chunk_04,Narrow Hills Provincial Park,"Narrow Hills Provincial Park is provincial park in Saskatchewan, Canada. It contains a series of recreational facilities and a variety of lakes within its boundaries. These include the Gem Lakes, Lower Fishing Lake, Upper Fishing Lake and others.",hotpotqa_huggingface_distractor,validation,geography,hotpotqa_mini_0006,5a75e05c55429976ec32bc5f,4,False,S1_hotpotqa_mini,shared_retrieval_corpus
hotpotqa_mini_0006_doc_05,hotpotqa_mini_0006_chunk_05,Shawnee State Fishing Lake,"Shawnee State Fishing Lake is approximately eight miles northwest of Topeka, Kansas, and is in northern Shawnee County, Kansas. This lake is sometimes confused with Lake Shawnee, on the east side of Topeka. It is a 135 acre surface area lake with a maximum depth of 25 ft . This is a manmade freshwater lake, which was constructed in the late 1960s. The lake is widest at the dam, which is at the south end of the lake. It can be reached by a number of roads. The only asphalted road reaching it is on the southeast corner. To the north is 94th Street and on the west side is Humphrey Road.",hotpotqa_huggingface_distractor,validation,geography,hotpotqa_mini_0006,5a75e05c55429976ec32bc5f,5,False,S1_hotpotqa_mini,shared_retrieval_corpus
hotpotqa_mini_0006_doc_06,hotpotqa_mini_0006_chunk_06,"Higgins Lake, Michigan","Higgins Lake is a small unincorporated community along the southern and western shores of Higgins Lake, a recreational and fishing lake in Roscommon County, in the U.S. state of Michigan. Higgins Lake is the name of the post office for the area, with ZIP code 48627. This ZIP code includes several other small communities and locales along the shores of the lake, including (moving counter-clockwise around the lake) Hillcrest, Lyon Manor, Detroit Park, Cook Corner, Sharps Corner, Almeda Beach, Oak Grove, Ritz Corner, Pine Bluffs, and Cottage Grove. Since all have Higgins Lake as a postal address, they are often all considered as part of the Higgins Lake community. The lake is situated on the boundary between Lyon Township on the west and Gerrish Township on the east. US 127 passes on the west side of the lake while I-75 and M-18 both pass a few miles to the east. Houghton Lake is just a few miles to the south.",hotpotqa_huggingface_distractor,validation,geography,hotpotqa_mini_0006,5a75e05c55429976ec32bc5f,6,False,S1_hotpotqa_mini,shared_retrieval_corpus
hotpotqa_mini_0006_doc_07,hotpotqa_mini_0006_chunk_07,Higgins Lake,"Higgins Lake is a large recreational and fishing lake in Roscommon County, in the U.S. state of Michigan. The 9,900 acre (40 km²) lake is known for its deep, clear waters and is the 10th largest in Michigan with a shoreline of 21 mi . It is named after Sylvester Higgins, the first chief of the topographical department of the Michigan Geological Survey. It has a maximum width of 4 mi and a length of 7 mi with a maximum depth of 135 ft . The mean depth is 44 ft and the lake contains almost 20 billion cubic feet (570 million m³) of water. Its retention time is about 12.5 years. The lake's watershed covers 19,000 acres (77 km²). The twin-lobed lake receives half of its water from submerged springs, six percent from incoming streams, and the remainder from direct rainfall and runoff. It drains into Marl Lake by the Cut River which runs into Houghton Lake and eventually to Lake Michigan. A mile north of the lake, water flows into the Lake Huron watershed.",hotpotqa_huggingface_distractor,validation,geography,hotpotqa_mini_0006,5a75e05c55429976ec32bc5f,7,False,S1_hotpotqa_mini,shared_retrieval_corpus
hotpotqa_mini_0006_doc_08,hotpotqa_mini_0006_chunk_08,Commanda Lake,"Commanda Lake (or Lake Commanda) is a lake in central Ontario, Canada. Located on the border between Patterson Township and Pringle Township, in the Almaguin Highlands region of the District of Parry Sound, it is fed by Gee Creek, Commanda Creek and Beaudry Creek and is drained by the Restoule River. The Lake is shaped like the number ""3"", its middle spur is called Deep Bay. The lake is home to one permanent island, located off a point in its east. This is a mud bottom lake and its water is ""tea coloured."" On the north shore of the lake is the community of Restoule, but cottages line many of the shore lines. Lots of crown land also surrounds the lake shore making it a very peaceful lake for people of all ages to enjoy. This lake has one public boat launch towards the southern end of the lake accessible on Commanda Lake Road. The lake is located at an altitude of 222 m (729 ft) above sea level. The lake is home to the Northern pike, Walleye, Smallmouth bass and Largemouth bass species of fish. Ice gets thick in the winter making this lake an all year round fishing lake.",hotpotqa_huggingface_distractor,validation,geography,hotpotqa_mini_0006,5a75e05c55429976ec32bc5f,8,False,S1_hotpotqa_mini,shared_retrieval_corpus
hotpotqa_mini_0006_doc_09,hotpotqa_mini_0006_chunk_09,"Brown County, Kansas","Brown County (county code BR) is a county located in the northeast portion of the U.S. state of Kansas. As of the 2010 census, the county population was 9,984. Its county seat and most populous city is Hiawatha. Brown County is the location of the Kickapoo Indian Reservation of Kansas, the majority of the Sac and Fox Reservation and the majority of the Iowa Reservation of Kansas and Nebraska.",hotpotqa_huggingface_distractor,validation,geography,hotpotqa_mini_0006,5a75e05c55429976ec32bc5f,9,True,S1_hotpotqa_mini,shared_retrieval_corpus
hotpotqa_mini_0007_doc_00,hotpotqa_mini_0007_chunk_00,United States Assistant Secretary of State,"Assistant Secretary of State (A/S) is a title used for many executive positions in the United States Department of State, ranking below the Under Secretaries. A set of six Assistant Secretaries reporting to the Under Secretary for Political Affairs manage diplomatic missions within their designated geographic regions, plus one Assistant Secretary dealing with international organizations. Assistant Secretaries usually manage individual bureaus of the Department of State. When the manager of a bureau or another agency holds a title other than Assistant Secretary, such as ""Director,"" it can be said to be of ""Assistant Secretary equivalent rank."" Assistant Secretaries typically have a set of deputies, referred to as Deputy Assistant Secretaries (DAS).",hotpotqa_huggingface_distractor,validation,geography,hotpotqa_mini_0007,5ae0d4c9554299603e418468,0,False,S1_hotpotqa_mini,shared_retrieval_corpus
hotpotqa_mini_0007_doc_01,hotpotqa_mini_0007_chunk_01,Douglas J. Bennet,"Douglas Joseph “Doug” Bennet, Jr. (born June 23, 1938) is a former national political official and college president. He was the fifteenth president of Wesleyan University, in Middletown, Connecticut, from 1995 to 2007. Before that, he served as Assistant Secretary of State for International Organization Affairs in the Clinton Administration (1993–95) and Assistant Secretary of State for Legislative Affairs in the Carter administration (1977–79), was the President and CEO of National Public Radio (1983–93), and ran the U.S. Agency for International Development under President Carter (1979–81).",hotpotqa_huggingface_distractor,validation,geography,hotpotqa_mini_0007,5ae0d4c9554299603e418468,1,False,S1_hotpotqa_mini,shared_retrieval_corpus
hotpotqa_mini_0007_doc_02,hotpotqa_mini_0007_chunk_02,Richard Nixon,"Richard Milhous Nixon (January 9, 1913 – April 22, 1994) was the 37th President of the United States from 1969 until 1974, when he resigned from office, the only U.S. president to do so. He had previously served as the 36th Vice President of the United States from 1953 to 1961, and prior to that as a U.S. Representative and also Senator from California.",hotpotqa_huggingface_distractor,validation,geography,hotpotqa_mini_0007,5ae0d4c9554299603e418468,2,True,S1_hotpotqa_mini,shared_retrieval_corpus
hotpotqa_mini_0007_doc_03,hotpotqa_mini_0007_chunk_03,Steven K. Galson,"Steven Kenneth Galson (born 1956) is an American public health physician. He is currently Senior Vice President for Global Regulatory Affairs at Amgen, the S. California-based innovative global biopharmaceutical company. He is also Professor-at-Large at the Keck Graduate Institute for Applied Life Sciences in Clarmont, California. He is a retired rear admiral in the United States Public Health Service Commissioned Corps and public health administrator who served as the acting Surgeon General of the United States from October 1, 2007 – October 1, 2009. He served concurrently as acting Assistant Secretary for Health from January 22, 2009 to June 25, 2009, and as the Deputy Director and Director of the Center for Drug Evaluation and Research (CDER) at the Food and Drug Administration from 2001 to 2007. As the Acting Surgeon General, he was the commander of the United States Public Health Service Commissioned Corps and, while serving as the Assistant Secretary for Health, was the operational head of the Public Health Service.",hotpotqa_huggingface_distractor,validation,geography,hotpotqa_mini_0007,5ae0d4c9554299603e418468,3,False,S1_hotpotqa_mini,shared_retrieval_corpus
hotpotqa_mini_0007_doc_04,hotpotqa_mini_0007_chunk_04,Robert R. Hood,Robert R. Hood is an American government official who currently serves as Assistant Secretary of Defense for Legislative Affairs. Hood was previously vice president for government affairs for CH2M. Past roles with the federal government include a role at the White House as Special Assistant to the President in the Office of Legislative Affairs and posts at the United States Department of Defense as principal deputy assistant secretary for legislative affairs and as deputy under secretary of defense for budget and appropriations affairs. Hood was also the director of congressional affairs at the National Nuclear Security Administration.,hotpotqa_huggingface_distractor,validation,geography,hotpotqa_mini_0007,5ae0d4c9554299603e418468,4,False,S1_hotpotqa_mini,shared_retrieval_corpus
