doc_id,chunk_id,title,text,source,source_split,topic,question_id,original_hotpotqa_id,paragraph_index,is_gold_evidence,source_system,s2_corpus_role
hotpotqa_mini_0000_doc_00,hotpotqa_mini_0000_chunk_00,Esma Sultan (daughter of Abdülaziz),"Esma Sultan (21 March 1873 – 7 May 1899) was an Ottoman princess, the daughter of Sultan Abdülaziz and his wife Gevheri Kadın, herself the daughter of Salih Bey Svatnba. She was the half-sister of Abdülmecid II, the last Caliph of the Muslim world.",hotpotqa_huggingface_distractor,validation,geography,hotpotqa_mini_0000,5adbf0a255429947ff17385a,0,False,S1_hotpotqa_mini,shared_retrieval_corpus
hotpotqa_mini_0000_doc_01,hotpotqa_mini_0000_chunk_01,Djamaâ el Kebir,"The Great Mosque of Algiers (Arabic: الجامع الكبير‎ ‎ , ""Jemaa Kebir"") or “Djama’a al-Kebir” (meaning Great Mosque) is a mosque in Algiers, Algeria, located very close to Algiers Harbor. An inscription on the minbar (منبر) or the pulpit testifies to fact that the mosque was built in 1097. It is also known by several other names such as Grand Mosque d'Alger, Djamaa al-Kebir, El Kebir Mosque and Jami Masjid. It is one of the few remaining examples of Almoravid architecture. It is the oldest mosque in Algiers and is said to be the oldest mosque in Algeria after Sidi Okba Mosque. It was built under sultan Ali ibn Yusuf. Its minaret dates from 1332 (1324 in some sources) and was built by the Ziyyanid Sultan of Tlemcen. The gallery at the outside of the mosque was built in 1840. Its construction was a consequence of a complete reconstruction of the street by the French.",hotpotqa_huggingface_distractor,validation,geography,hotpotqa_mini_0000,5adbf0a255429947ff17385a,1,False,S1_hotpotqa_mini,shared_retrieval_corpus
hotpotqa_mini_0000_doc_02,hotpotqa_mini_0000_chunk_02,Küçük Hüseyin Pasha,"Küçük Hüseyin Pasha (1757 – 7 December 1803), also known as Tayazade Damat Küçük Hüseyin Pasha, was an Ottoman statesman and admiral who was Kapudan Pasha (Grand Admiral of the Ottoman Navy) from 11 March 1792 to 7 December 1803. He was a ""damat"" (""bridegroom"") to the Ottoman dynasty after he married an Ottoman princess, Esma Sultan.",hotpotqa_huggingface_distractor,validation,geography,hotpotqa_mini_0000,5adbf0a255429947ff17385a,2,False,S1_hotpotqa_mini,shared_retrieval_corpus
hotpotqa_mini_0000_doc_03,hotpotqa_mini_0000_chunk_03,Esma Sultan (daughter of Abdul Hamid I),"Esma Sultan (17 July 1778 – 4 June 1848) was an Ottoman princess, daughter of Sultan Abdul Hamid I, sister of Sultan Mustafa IV and Sultan Mahmud II. She was the adoptive mother of Bezmiâlem Sultan and Rahime Perestu Sultan.",hotpotqa_huggingface_distractor,validation,geography,hotpotqa_mini_0000,5adbf0a255429947ff17385a,3,False,S1_hotpotqa_mini,shared_retrieval_corpus
hotpotqa_mini_0000_doc_04,hotpotqa_mini_0000_chunk_04,Sultan Ahmed Mosque,"The Sultan Ahmed Mosque or Sultan Ahmet Mosque (Turkish: ""Sultan Ahmet Camii"" ) is a historic mosque located in Istanbul, Turkey. A popular tourist site, the Sultan Ahmed Mosque continues to function as a mosque today; men still kneel in prayer on the mosque's lush red carpet after the call to prayer. The Blue Mosque, as it is popularly known, was constructed between 1609 and 1616 during the rule of Ahmed I. Its Külliye contains Ahmed's tomb, a madrasah and a hospice. Hand-painted blue tiles adorn the mosque’s interior walls, and at night the mosque is bathed in blue as lights frame the mosque’s five main domes, six minarets and eight secondary domes. It sits next to the Hagia Sophia, another popular tourist site.",hotpotqa_huggingface_distractor,validation,geography,hotpotqa_mini_0000,5adbf0a255429947ff17385a,4,False,S1_hotpotqa_mini,shared_retrieval_corpus
hotpotqa_mini_0000_doc_05,hotpotqa_mini_0000_chunk_05,Laleli Mosque,"The Laleli Mosque (Turkish: ""Laleli Camii, or Tulip Mosque"" ) is an 18th-century Ottoman imperial mosque located in Laleli, Fatih, Istanbul, Turkey.",hotpotqa_huggingface_distractor,validation,geography,hotpotqa_mini_0000,5adbf0a255429947ff17385a,5,True,S1_hotpotqa_mini,shared_retrieval_corpus
hotpotqa_mini_0000_doc_06,hotpotqa_mini_0000_chunk_06,Esma Sultan Mansion,"The Esma Sultan Mansion (Turkish: ""Esma Sultan Yalısı"" ), a historical yalı (English: waterside mansion ) located at Bosphorus in Ortaköy neighborhood of Istanbul, Turkey and named after its original owner Esma Sultan, is used today as a cultural center after being redeveloped.",hotpotqa_huggingface_distractor,validation,geography,hotpotqa_mini_0000,5adbf0a255429947ff17385a,6,True,S1_hotpotqa_mini,shared_retrieval_corpus
hotpotqa_mini_0000_doc_07,hotpotqa_mini_0000_chunk_07,Esma Sultan,Esma Sultan is the name of three daughters of three Ottoman Sultans:,hotpotqa_huggingface_distractor,validation,geography,hotpotqa_mini_0000,5adbf0a255429947ff17385a,7,False,S1_hotpotqa_mini,shared_retrieval_corpus
hotpotqa_mini_0000_doc_08,hotpotqa_mini_0000_chunk_08,Gevheri Kadın,Gevheri Kadın (8 July 1856 – 6 September 1884) was the fifth wife of 32nd Ottoman Sultan Abdülaziz. She was the mother of Şehzade Mehmed Seyfeddin and Esma Sultan of the Ottoman Empire.,hotpotqa_huggingface_distractor,validation,geography,hotpotqa_mini_0000,5adbf0a255429947ff17385a,8,False,S1_hotpotqa_mini,shared_retrieval_corpus
hotpotqa_mini_0000_doc_09,hotpotqa_mini_0000_chunk_09,Esma Sultan (daughter of Ahmed III),"Esma Sultan (14 March 1726 – 13 August 1788) was an Ottoman princess, daughter of Sultan Ahmed III and his consort Zeynep Kadın. She was the half-sister of Sultan Mustafa III and Abdul Hamid I.",hotpotqa_huggingface_distractor,validation,geography,hotpotqa_mini_0000,5adbf0a255429947ff17385a,9,False,S1_hotpotqa_mini,shared_retrieval_corpus
hotpotqa_mini_0001_doc_00,hotpotqa_mini_0001_chunk_00,Just Another Romantic Wrestling Comedy,"Just Another Romantic Wrestling Comedy is a 2006 film starring April Hunter and Joanie Laurer. This Romantic comedy film was premiered at New Jersey and New York City on December 1, 2006 and was released on DVD in the United States and the United Kingdom on April 17, 2007. After the film's DVD release ""Just Another Romantic Wrestling Comedy"" won an ""Honorable Mention"" award at the New Jersey International Festival awards. The release is being handled by ""Victory Multimedia"".",hotpotqa_huggingface_distractor,validation,geography,hotpotqa_mini_0001,5a8e3ea95542995a26add48d,0,False,S1_hotpotqa_mini,shared_retrieval_corpus
hotpotqa_mini_0001_doc_01,hotpotqa_mini_0001_chunk_01,Kingston Morning,"Kingston Morning is Dave Eggar's 4th solo release recorded in Brooklyn, New York; Kingston, Jamaica; and Big Stone Gap, Virginia; and released by Domo Records. ""Itsbynne Reel"" was nominated at the 53rd Grammy Awards for ""Best Instrumental Arrangement"".",hotpotqa_huggingface_distractor,validation,geography,hotpotqa_mini_0001,5a8e3ea95542995a26add48d,1,False,S1_hotpotqa_mini,shared_retrieval_corpus
hotpotqa_mini_0001_doc_02,hotpotqa_mini_0001_chunk_02,Nola (film),"Nola is a 2003 American romantic comedy film written and directed by Alan Hruska. It depicts the struggle of a young woman trying to survive in New York City while looking for her birth father. It premiered in New York City on July 23, 2004.",hotpotqa_huggingface_distractor,validation,geography,hotpotqa_mini_0001,5a8e3ea95542995a26add48d,2,False,S1_hotpotqa_mini,shared_retrieval_corpus
hotpotqa_mini_0001_doc_03,hotpotqa_mini_0001_chunk_03,Adriana Trigiani,"Adriana Trigiani is an Italian American best-selling author of sixteen books, television writer, film director, and entrepreneur based in Greenwich Village, New York City. Trigiani has published a novel a year since 2000.",hotpotqa_huggingface_distractor,validation,geography,hotpotqa_mini_0001,5a8e3ea95542995a26add48d,3,True,S1_hotpotqa_mini,shared_retrieval_corpus
hotpotqa_mini_0001_doc_04,hotpotqa_mini_0001_chunk_04,Great Eastern Conventions,"Great Eastern Conventions, Inc. was an entertainment company which produced comic book conventions, most actively during the years 1987-1996. In New York City, the Great Eastern shows filled the gap between the mid-1980s demise of the annual Comic Art Convention and Creation Conventions, and the establishment of promoter Michael Carbonaro's annual Big Apple Comic Con in 1996. From 1993–1995, Great Eastern hosted two New York City shows annually at the Jacob K. Javits Convention Center. Great Eastern also ran shows in New Jersey, Pennsylvania, Massachusetts, Oregon, Minnesota, and Texas.",hotpotqa_huggingface_distractor,validation,geography,hotpotqa_mini_0001,5a8e3ea95542995a26add48d,4,False,S1_hotpotqa_mini,shared_retrieval_corpus
hotpotqa_mini_0001_doc_05,hotpotqa_mini_0001_chunk_05,New York Society of Model Engineers,"The New York Society of Model Engineers (NYSME) was originally incorporated in 1926 in New York City. There are published records that show the Society existed as early as 1905. In its early years, the organization moved to and from various locations throughout Manhattan. AT that time it was basically a gentlemen's club of members who were interested in all types of model building. In 1926 the Society was formalized and incorporated under the laws of the State of New York. This was done so that the Society could obtain a permit to use a lake in New York City's Central Park for model motor boat races. It was also at this time that the Society began construction of its first Model Railroad "" The Union Connecting"". Over the next twenty years, the Society moved from its original location to two other locations. Each move doubling the size of the previous location and of course doubling the size of the model train layout. During WW2 many Society members were called to service in the Armed Forces. Regrettably, the largest of the layouts had to be dismantled. The location of the layout in the basement of the Astor Building was requested for the war effort. The dismantling was done with care, with salvaged usable materials going into scrap drives for the War effort. As members returned after the War a new location was searched for. This led to an invitation from the Lackawanna Railroad to move into their Passenger Terminal in Hoboken,NJ. They had the space for what would become the largest model railroad in the world at that time. The space? Only the ornate waiting room for the recently discontinued ferry boats to 23rd Street in New York City. Here the layout was built. It was based on the Lackawanna Railroad from Hoboken to Scranton, Pa. It was magnificent; from the scale model of the Hoboken Terminal to the soaring Delaware Water Gap. During the early-1950s the organization moved to its current location in Carlstadt, New Jersey.",hotpotqa_huggingface_distractor,validation,geography,hotpotqa_mini_0001,5a8e3ea95542995a26add48d,5,False,S1_hotpotqa_mini,shared_retrieval_corpus
hotpotqa_mini_0001_doc_06,hotpotqa_mini_0001_chunk_06,"Clinton, Minnesota","Clinton is a city in Big Stone County, Minnesota, United States. The city was named for New York Governor DeWitt Clinton. The population was 449 at the 2010 census.",hotpotqa_huggingface_distractor,validation,geography,hotpotqa_mini_0001,5a8e3ea95542995a26add48d,6,False,S1_hotpotqa_mini,shared_retrieval_corpus
hotpotqa_mini_0001_doc_07,hotpotqa_mini_0001_chunk_07,Hamish and Andy's Gap Year,"Hamish & Andy's Gap Year is a Logie Award winning comedy series following Hamish Blake and Andy Lee, a pair of Australian comedians, on their trips to various international locations. The first season saw the boys visiting America for ten episodes and broadcast their show weekly from New York City. In its second season in 2012, the show was titled ""Hamish & Andy's Euro Gap Year"" and seven episodes were broadcast from The Lord Stanley, a disused pub in East London, England. The third season known as ""Hamish and Andy's Gap Year Asia"" in 2013 was broadcast from a bar in Bangkok, Thailand, called 'The Raintree'.",hotpotqa_huggingface_distractor,validation,geography,hotpotqa_mini_0001,5a8e3ea95542995a26add48d,7,False,S1_hotpotqa_mini,shared_retrieval_corpus
hotpotqa_mini_0001_doc_08,hotpotqa_mini_0001_chunk_08,I Love NY (2015 film),"I Love NY, also known as I Love New Year, is an Indian romantic comedy film directed by Radhika Rao and Vinay Sapru starring Sunny Deol and Kangana Ranaut in lead roles. The film is produced by Bhushan Kumar and Krishan Kumar under the banner of Super Cassettes Industries Ltd. The film was extensively shot in Mumbai, New York City and Bangkok. The main plot was taken from the Russian romantic comedy ""The Irony of Fate"" (1976). After numerous delays, the film released on 10 July 2015.",hotpotqa_huggingface_distractor,validation,geography,hotpotqa_mini_0001,5a8e3ea95542995a26add48d,8,False,S1_hotpotqa_mini,shared_retrieval_corpus
hotpotqa_mini_0001_doc_09,hotpotqa_mini_0001_chunk_09,Big Stone Gap (film),"Big Stone Gap is a 2014 American drama romantic comedy film written and directed by Adriana Trigiani and produced by Donna Gigliotti for Altar Identity Studios, a subsidiary of Media Society. Based on Trigiani's 2000 best-selling novel of the same name, the story is set in the actual Virginia town of Big Stone Gap circa 1970s. The film had its world premiere at the Virginia Film Festival on November 6, 2014.",hotpotqa_huggingface_distractor,validation,geography,hotpotqa_mini_0001,5a8e3ea95542995a26add48d,9,True,S1_hotpotqa_mini,shared_retrieval_corpus
hotpotqa_mini_0002_doc_00,hotpotqa_mini_0002_chunk_00,Billings Bulls,"The Billings Bulls were a junior ice hockey organization based in Billings, Montana. They most recently played home games at the 550-seat Centennial Ice Arena and due to the arena's small size, the Bulls frequently sold out games. They previously played their home games in the Metrapark which had a max capacity of 9,000 for hockey games. However, a negotiating dispute with arena officials and local county commissioners resulted in the team losing its lease.",hotpotqa_huggingface_distractor,validation,geography,hotpotqa_mini_0002,5a87ab905542996e4f3088c1,0,False,S1_hotpotqa_mini,shared_retrieval_corpus
hotpotqa_mini_0002_doc_01,hotpotqa_mini_0002_chunk_01,Robins Center,"The Robins Center is a 7,201-seat multi-purpose arena in Richmond, Virginia. Opened in 1972, the arena is home to the University of Richmond Spiders basketball. It hosted the ECAC South (now known as the Colonial Athletic Association) men's basketball tournament in 1983. It is named for E. Claiborne Robins Sr, class of 1931, who, along with his family, have been leading benefactors for the school. The opening of the Robins Center returning Spider basketball to an on-campus facility for the first time since the mid-1940s when it outgrew Millhiser Gymnasium. In the intervening decades, the Spiders played home games in numerous locations around the Richmond area, including the Richmond Coliseum (1971–1972), the Richmond Arena (1954–1971), the Benedictine High School gymnasium (1951–1954), Grays' Armory (1950–1951) and Blues' Armory (1947–1950). The Robins Center arena serves as the location of the University of Richmond's commencement exercises and hosted a 1992 Presidential debate involving Bill Clinton, George H. W. Bush, and Ross Perot.",hotpotqa_huggingface_distractor,validation,geography,hotpotqa_mini_0002,5a87ab905542996e4f3088c1,1,False,S1_hotpotqa_mini,shared_retrieval_corpus
hotpotqa_mini_0002_doc_02,hotpotqa_mini_0002_chunk_02,2011–12 QMJHL season,"The 2011–12 QMJHL season was the 43rd season of the Quebec Major Junior Hockey League (QMJHL). The regular season, which consisted of seventeen teams playing 68 games each, began in September 2011 and ended in March 2012. This season was Blainville-Boisbriand Armada's first season in the league, as the team relocated to Boisbriand from Verdun where they played as the Montreal Junior Hockey Club from 2008 to 2011. The league lost one of his charter teams when the Lewiston Maineiacs folded during after the previous season, the QMJHL later announce an expansion team to Sherbrooke for the 2012-2013 season. In the playoffs, the Saint John Sea Dogs became the seventh team in league history to capture consecutive President's Cup championships.",hotpotqa_huggingface_distractor,validation,geography,hotpotqa_mini_0002,5a87ab905542996e4f3088c1,2,False,S1_hotpotqa_mini,shared_retrieval_corpus
hotpotqa_mini_0002_doc_03,hotpotqa_mini_0002_chunk_03,Loan modification in the United States,"Loan modification is the systematic alteration of mortgage loan agreements that help those having problems making the payments by reducing interest rates, monthly payments or principal balances. Lending institutions could make one or more of these changes to relieve financial pressure on borrowers to prevent the condition of foreclosure. Loan modifications have been practiced in the United States since The 2008 Crash Of The Housing Market from Washington Mutual, Chase Home Finance, Chase, JP Morgan & Chase, other contributors like MER's. Crimes of Mortgage ad Real Estate Staff had long assisted nd finally the squeaky will could not continue as their deviant practices broke the state and crashed. Modification owners either ordered by The United States Department of Housing, The United States IRS or President Obamas letters from Note Holders came to those various departments asking for the Democratic process to help them keep their homes and protection them from explosion. Thus the birth of Modifications. It is yet to date for clarity how theses enforcements came into existence and except b whom, but t is certain that note holders form the Midwest reached out in the Democratic Process for assistance. FBI Mortgage Fraud Department came into existence. Modifications HMAP HARP were also birthed to help note holders get Justice through reduced mortgage by making terms legal. Modification of mortgage terms was introduced by IRS staff addressing the crisis called the HAMP TEAMS that went across the United States desiring the new products to assist homeowners that were victims of predatory lending practices, unethical staff, brokers, attorneys and lenders that contributed to the crash. Modification were a fix to the crash as litigation has ensued as the lenders reorganized and renamed the lending institutions and government agencies are to closely monitor them. Prior to modifications loan holders that experiences crisis would use Loan assumptions and Loan transfers to keep the note in the 1930s. During the Great Depression, loan transfers, loan assumption, and loan bail out programs took place at the state level in an effort to reduce levels of loan foreclosures while the Federal Bureau of Investigation, Federal Trade Commission, Comptroller, the United States Government and State Government responded to lending institution violations of law in these arenas by setting public court records that are legal precedence of such illegal actions. The legal precedents and reporting agencies were created to address the violations of laws to consumers while the Modifications were created to assist the consumers that are victims of predatory lending practices. During the so-called ""Great Recession"" of the early 21st century, loan modification became a matter of national policy, with various actions taken to alter mortgage loan terms to prevent further economic destabilization. Due to absorbent personal profits nothing has been done to educate Homeowners or Creditors that this money from equity, escrow is truly theirs the Loan Note Holder and it is their monetary rights as the real prize and reason for the Housing Crash was the profit n obtaining the mortgage holders Escrow. The Escrow and Equity that is accursed form the Note Holders payments various staff through the United States claimed as recorded and cashed by all staff in real-estate from local residential Tax Assessing Staff, Real Estate Staff, Ordinance Staff, Police Staff, Brokers, attorneys, lending institutional staff but typically Attorneys who are also typically the owners or Rental properties that are trained through Bankruptcies'. that collect the Escrow that is rightfully the Homeowners but because most Homeowners are unaware of what money is due them and how they can loose their escrow. Most Creditors are unaware that as the note holder that the Note Holder are due a annual or semi annual equity check and again bank or other lending and or legal intuitions staff claim this monies instead. This money Note Holders were unaware of is the prize of real estate and the cause of the Real Estate Crash of 2008 where Lending Institutions provided mortgages to people years prior they know they would eventually loose with Loan holders purchasing Balloon Mortgages lending product that is designed to make fast money off the note holder whom is always typically unaware of their escrow, equity and that are further victimized by conferences and books on HOW TO MAKE MONEY IN REAL STATE - when in fact the money is the Note Holder. The key of the crash was not the House, but the loan product used and the interest and money that was accrued form the note holders that staff too immorally. The immoral and illegal actions of predatory lending station and their staff began with the inception of balloon mortgages although illegal activity has always existed in the arena, yet the crash created ""Watch Dog"" like HAMP TEAM, IRS, COMPTROLLER< Federal Trade Commission Consumer Protection Bureau, FBI, CIA, Local Police Department, ICE ( The FBI online Computer crime division receives and investigates computer crimes that record keeping staff from title companies, lending institutional staff, legal staff and others created fraudulent documents to change payments and billing of note holders to obtain the money note holders are typically unaware of) and other watch dog agencies came into existence to examine if houses were purchased through a processed check at Government Debited office as many obtained free homes illegally. Many were incarcerated for such illegal actions. Modifications fixed the Notes to proper lower interest, escrow, tax fees that staff typically raised for no reason. Many people from various arenas involved in reals estate have been incarcerated for these actions as well as other illegal actions like charging for a modification. Additionally Modifications were also made to address the falsifications such as inappropriate mortgage charges, filing of fraudulently deeds, reporting of and at times filing of fraudulent mortgages that were already paid off that were fraudulently continued by lenders staff and attorneys or brokers or anyone in the Real Estate Chain through the issues of real estate terms to continue to violate United States Laws, contract law and legal precedence where collusion was often done again to defraud and steal from the Note Holder was such a common practice that was evidence as to why the Mortgage Crash in 2008 occurred for the purpose of wining the prize of stealing form Homeowners and those that foreclosed was actually often purposefully for these monies note holders were unaware of to be obtained which was why Balloon mortgages and loans were given to the staff in the Real Estate Market with the hoper and the expectation that the loan holders would default as it offered opportunity to commit illegal transactions of obtaining the homeowners funds. While such scams were addressed through modifications in 2008. The Market relied heavily on Consumers ignorance to prosper, ignorance of real estate terms, ignorance on what they were to be charged properly for unethical financial gain and while staff in real estates lending arenas mingled terms to deceive y deliberate confusion consumers out of cash and homes while the USA Government provided Justice through President Obamas Inception and IRS Inception of Modifications which addressed these unethical profits in Reals Estate. It was in 2009 that HARP, HAMP and Modifications were introduced to stop the victimization of Note Holders. Taking on the Banks that ran USA Government was a great and dangerous undertaking that made America Great Again as Justice for Consumers reigned. Legal action taken against institutions that have such business practices can be viewed in State Code of Law and Federal Law on precedent cases that are available to the public. Finally, It had been unlawful to be charged by an attorney to modify as well as fro banking staff to modify terms to increase a mortgage and or change lending product to a balloon in an concerted effort to make homeowner foreclose which is also illegal, computer fraud and not the governments intended purpose or definition of a modification.",hotpotqa_huggingface_distractor,validation,geography,hotpotqa_mini_0002,5a87ab905542996e4f3088c1,3,False,S1_hotpotqa_mini,shared_retrieval_corpus
hotpotqa_mini_0002_doc_04,hotpotqa_mini_0002_chunk_04,Case Gym,"Case Gym is a 1,800-seat multi-purpose arena at Boston University in Boston, Massachusetts. It opened in 1972 as part of the Harold Case Physical Education Center, which is named after the university's fifth president, Harold C. Case. The gym is referred to as ""The Roof"" because it is located on the top level of the building, above Walter Brown Arena. It is home to the Boston University Terriers men's and women's basketball teams, as well as the men's wrestling team. Basketball games are also played in Agganis Arena, and on occasion Walter Brown Arena. When Boston University left the America East Conference for the Patriot League in July 2013, they announced that all home men's basketball conference games would be played at Agganis Arena, with the non-conference games to be played at Case.",hotpotqa_huggingface_distractor,validation,geography,hotpotqa_mini_0002,5a87ab905542996e4f3088c1,4,False,S1_hotpotqa_mini,shared_retrieval_corpus
